{
  "id": "bedrock:openai-compatible",
  "version": 1,
  "displayName": "AWS Bedrock (OpenAI-compatible)",
  "providerBaseId": "bedrock",
  "description": "AWS Bedrock OpenAI-compatible Chat Completions endpoint (region-specific URL).",
  "modelId": "",
  "endpoint": {
    "kind": "static",
    "url": ""
  },
  "auth": {
    "kind": "bearer",
    "fields": [
      "apiKey"
    ]
  },
  "defaults": {},
  "schema": [],
  "uiSchema": {
    "groups": [],
    "fields": []
  },
  "capabilities": [
    "streaming",
    "reasoning",
    "vision",
    "tools"
  ],
  "sourceUrls": [
    "https://docs.aws.amazon.com/bedrock/latest/userguide/inference-chat-completions-mantle.html"
  ],
  "tags": [
    "aws",
    "bedrock",
    "openai-compatible"
  ],
  "sortOrder": 800,
  "displayNameI18n": {
    "ko": "AWS Bedrock (OpenAI 호환)"
  },
  "descriptionI18n": {
    "ko": "AWS Bedrock OpenAI 호환 Chat Completions 엔드포인트 (리전별 URL)."
  },
  "profileStatus": "current"
}
