{
  "id": "openrouter:openai-compatible",
  "version": 1,
  "displayName": "OpenRouter",
  "providerBaseId": "openrouter",
  "description": "OpenRouter multi-vendor router via OpenAI-compatible API.",
  "modelId": "",
  "endpoint": {
    "kind": "static",
    "url": "https://openrouter.ai/api/v1/chat/completions"
  },
  "auth": {
    "kind": "bearer",
    "fields": [
      "apiKey"
    ]
  },
  "defaults": {},
  "schema": [],
  "uiSchema": {
    "groups": [],
    "fields": []
  },
  "capabilities": [
    "streaming",
    "reasoning",
    "vision",
    "tools"
  ],
  "sourceUrls": [
    "https://openrouter.ai/docs"
  ],
  "tags": [
    "openrouter",
    "aggregator",
    "openai-compatible"
  ],
  "sortOrder": 500,
  "displayNameI18n": {
    "ko": "OpenRouter"
  },
  "descriptionI18n": {
    "ko": "OpenRouter 다중 공급자 라우터 (OpenAI 호환 API)."
  },
  "profileStatus": "current"
}
